{
  "initial_pose_type": "EGO_MOTION",
  "keyframes_metadata": [
    {
      "id": "0",
      "camera_params_id": "0",
      "synced_sample_id": "5",
      "image_name": "front_stereo_camera_left/1771445398921412053.jpeg",
      "timestamp_microseconds": "1771445398921412"
    },
    {
      "id": "11",
      "camera_params_id": "1",
      "synced_sample_id": "5",
      "image_name": "front_stereo_camera_right/1771445398921412053.jpeg",
      "timestamp_microseconds": "1771445398921412"
    },
    {
      "id": "17",
      "camera_params_id": "0",
      "synced_sample_id": "15",
      "image_name": "front_stereo_camera_left/1771445399254733053.jpeg",
      "timestamp_microseconds": "1771445399254733"
    },
    {
      "id": "32",
      "camera_params_id": "1",
      "synced_sample_id": "15",
      "image_name": "front_stereo_camera_right/1771445399254733053.jpeg",
      "timestamp_microseconds": "1771445399254733"
    },
    {
      "id": "37",
      "camera_params_id": "0",
      "synced_sample_id": "25",
      "image_name": "front_stereo_camera_left/1771445399588055053.jpeg",
      "timestamp_microseconds": "1771445399588055"
    },
    {
      "id": "52",
      "camera_params_id": "1",
      "synced_sample_id": "25",
      "image_name": "front_stereo_camera_right/1771445399588055053.jpeg",
      "timestamp_microseconds": "1771445399588055"
    },
    {
      "id": "56",
      "camera_params_id": "0",
      "synced_sample_id": "35",
      "image_name": "front_stereo_camera_left/1771445399921377045.jpeg",
      "timestamp_microseconds": "1771445399921377"
    },
    {
      "id": "74",
      "camera_params_id": "1",
      "synced_sample_id": "35",
      "image_name": "front_stereo_camera_right/1771445399921377045.jpeg",
      "timestamp_microseconds": "1771445399921377"
    },
    {
      "id": "75",
      "camera_params_id": "0",
      "synced_sample_id": "45",
      "image_name": "front_stereo_camera_left/1771445400254693045.jpeg",
      "timestamp_microseconds": "1771445400254693"
    },
    {
      "id": "94",
      "camera_params_id": "1",
      "synced_sample_id": "45",
      "image_name": "front_stereo_camera_right/1771445400254693045.jpeg",
      "timestamp_microseconds": "1771445400254693"
    },
    {
      "id": "95",
      "camera_params_id": "0",
      "synced_sample_id": "55",
      "image_name": "front_stereo_camera_left/1771445400588032045.jpeg",
      "timestamp_microseconds": "1771445400588032"
    },
    {
      "id": "112",
      "camera_params_id": "0",
      "synced_sample_id": "65",
      "image_name": "front_stereo_camera_left/1771445400921353081.jpeg",
      "timestamp_microseconds": "1771445400921353"
    },
    {
      "id": "118",
      "camera_params_id": "1",
      "synced_sample_id": "55",
      "image_name": "front_stereo_camera_right/1771445400588032045.jpeg",
      "timestamp_microseconds": "1771445400588032"
    },
    {
      "id": "131",
      "camera_params_id": "0",
      "synced_sample_id": "75",
      "image_name": "front_stereo_camera_left/1771445401254674081.jpeg",
      "timestamp_microseconds": "1771445401254674"
    },
    {
      "id": "137",
      "camera_params_id": "1",
      "synced_sample_id": "65",
      "image_name": "front_stereo_camera_right/1771445400921353081.jpeg",
      "timestamp_microseconds": "1771445400921353"
    },
    {
      "id": "153",
      "camera_params_id": "0",
      "synced_sample_id": "85",
      "image_name": "front_stereo_camera_left/1771445401587995081.jpeg",
      "timestamp_microseconds": "1771445401587995"
    },
    {
      "id": "156",
      "camera_params_id": "1",
      "synced_sample_id": "75",
      "image_name": "front_stereo_camera_right/1771445401254674081.jpeg",
      "timestamp_microseconds": "1771445401254674"
    },
    {
      "id": "173",
      "camera_params_id": "0",
      "synced_sample_id": "95",
      "image_name": "front_stereo_camera_left/1771445401921334060.jpeg",
      "timestamp_microseconds": "1771445401921334"
    },
    {
      "id": "176",
      "camera_params_id": "1",
      "synced_sample_id": "85",
      "image_name": "front_stereo_camera_right/1771445401587995081.jpeg",
      "timestamp_microseconds": "1771445401587995"
    },
    {
      "id": "192",
      "camera_params_id": "0",
      "synced_sample_id": "105",
      "image_name": "front_stereo_camera_left/1771445402254654060.jpeg",
      "timestamp_microseconds": "1771445402254654"
    },
    {
      "id": "197",
      "camera_params_id": "1",
      "synced_sample_id": "95",
      "image_name": "front_stereo_camera_right/1771445401921334060.jpeg",
      "timestamp_microseconds": "1771445401921334"
    },
    {
      "id": "211",
      "camera_params_id": "0",
      "synced_sample_id": "115",
      "image_name": "front_stereo_camera_left/1771445402587975060.jpeg",
      "timestamp_microseconds": "1771445402587975"
    },
    {
      "id": "217",
      "camera_params_id": "1",
      "synced_sample_id": "105",
      "image_name": "front_stereo_camera_right/1771445402254654060.jpeg",
      "timestamp_microseconds": "1771445402254654"
    },
    {
      "id": "232",
      "camera_params_id": "0",
      "synced_sample_id": "125",
      "image_name": "front_stereo_camera_left/1771445402921296020.jpeg",
      "timestamp_microseconds": "1771445402921296"
    },
    {
      "id": "237",
      "camera_params_id": "1",
      "synced_sample_id": "115",
      "image_name": "front_stereo_camera_right/1771445402587975060.jpeg",
      "timestamp_microseconds": "1771445402587975"
    },
    {
      "id": "254",
      "camera_params_id": "0",
      "synced_sample_id": "135",
      "image_name": "front_stereo_camera_left/1771445403254617020.jpeg",
      "timestamp_microseconds": "1771445403254617"
    },
    {
      "id": "255",
      "camera_params_id": "1",
      "synced_sample_id": "125",
      "image_name": "front_stereo_camera_right/1771445402921296020.jpeg",
      "timestamp_microseconds": "1771445402921296"
    },
    {
      "id": "274",
      "camera_params_id": "0",
      "synced_sample_id": "145",
      "image_name": "front_stereo_camera_left/1771445403587955020.jpeg",
      "timestamp_microseconds": "1771445403587955"
    },
    {
      "id": "275",
      "camera_params_id": "1",
      "synced_sample_id": "135",
      "image_name": "front_stereo_camera_right/1771445403254617020.jpeg",
      "timestamp_microseconds": "1771445403254617"
    },
    {
      "id": "294",
      "camera_params_id": "0",
      "synced_sample_id": "155",
      "image_name": "front_stereo_camera_left/1771445403921276017.jpeg",
      "timestamp_microseconds": "1771445403921276"
    },
    {
      "id": "295",
      "camera_params_id": "1",
      "synced_sample_id": "145",
      "image_name": "front_stereo_camera_right/1771445403587955020.jpeg",
      "timestamp_microseconds": "1771445403587955"
    },
    {
      "id": "314",
      "camera_params_id": "0",
      "synced_sample_id": "165",
      "image_name": "front_stereo_camera_left/1771445404254597017.jpeg",
      "timestamp_microseconds": "1771445404254597"
    },
    {
      "id": "315",
      "camera_params_id": "1",
      "synced_sample_id": "155",
      "image_name": "front_stereo_camera_right/1771445403921276017.jpeg",
      "timestamp_microseconds": "1771445403921276"
    },
    {
      "id": "334",
      "camera_params_id": "0",
      "synced_sample_id": "175",
      "image_name": "front_stereo_camera_left/1771445404587918017.jpeg",
      "timestamp_microseconds": "1771445404587918"
    },
    {
      "id": "335",
      "camera_params_id": "1",
      "synced_sample_id": "165",
      "image_name": "front_stereo_camera_right/1771445404254597017.jpeg",
      "timestamp_microseconds": "1771445404254597"
    },
    {
      "id": "354",
      "camera_params_id": "0",
      "synced_sample_id": "185",
      "image_name": "front_stereo_camera_left/1771445404921238120.jpeg",
      "timestamp_microseconds": "1771445404921238"
    },
    {
      "id": "355",
      "camera_params_id": "1",
      "synced_sample_id": "175",
      "image_name": "front_stereo_camera_right/1771445404587918017.jpeg",
      "timestamp_microseconds": "1771445404587918"
    },
    {
      "id": "374",
      "camera_params_id": "0",
      "synced_sample_id": "195",
      "image_name": "front_stereo_camera_left/1771445405254580120.jpeg",
      "timestamp_microseconds": "1771445405254580"
    },
    {
      "id": "375",
      "camera_params_id": "1",
      "synced_sample_id": "185",
      "image_name": "front_stereo_camera_right/1771445404921238120.jpeg",
      "timestamp_microseconds": "1771445404921238"
    },
    {
      "id": "394",
      "camera_params_id": "0",
      "synced_sample_id": "205",
      "image_name": "front_stereo_camera_left/1771445405587902120.jpeg",
      "timestamp_microseconds": "1771445405587902"
    },
    {
      "id": "395",
      "camera_params_id": "1",
      "synced_sample_id": "195",
      "image_name": "front_stereo_camera_right/1771445405254580120.jpeg",
      "timestamp_microseconds": "1771445405254580"
    },
    {
      "id": "414",
      "camera_params_id": "0",
      "synced_sample_id": "215",
      "image_name": "front_stereo_camera_left/1771445405921219052.jpeg",
      "timestamp_microseconds": "1771445405921219"
    },
    {
      "id": "415",
      "camera_params_id": "1",
      "synced_sample_id": "205",
      "image_name": "front_stereo_camera_right/1771445405587902120.jpeg",
      "timestamp_microseconds": "1771445405587902"
    },
    {
      "id": "434",
      "camera_params_id": "0",
      "synced_sample_id": "225",
      "image_name": "front_stereo_camera_left/1771445406254540052.jpeg",
      "timestamp_microseconds": "1771445406254540"
    },
    {
      "id": "435",
      "camera_params_id": "1",
      "synced_sample_id": "215",
      "image_name": "front_stereo_camera_right/1771445405921219052.jpeg",
      "timestamp_microseconds": "1771445405921219"
    },
    {
      "id": "454",